,Korean Name,English Name,Image Url,Explanation,Category,Factors,kcal,sat_FAT,protein,fat,trans_FAT,sodium,sugars,caffeine,cholesterol,chabo
135,제주 까망 라떼,Jeju Black Sesame Latte,https://image.istarbucks.co.kr/upload/store/skuimg/2020/09/[9200000001301]_20200921171639786.jpg,"[제주지역 한정음료] 제주도의 돌담길과 하르방의 풍경을
느낄 수 있는 음료로 고소한 흑임자와 달콤한 소보로 토핑으로 
누구나 즐길 수 있는 음료",product_etc,알레르기 유발요인 : 땅콩 / 대두 / 우유 / 알류 / 밀 / 오징어,445,7,13,19,0,250,49,0,35,54
136,제주팔삭 셔벗,Jeju Hassaku Orange Blended,https://image.istarbucks.co.kr/upload/store/skuimg/2023/10/[9200000004957]_20231005084829752.jpg,"제주의 자몽이라는 별명을 가진 팔삭과
한라봉으로 매장에서 직접 만든 상큼한 셔벗",product_etc,,95,0,0,0,0,5,22,0,0,24
137,ABC 클렌즈 190ML,ABC Cleanse Juice 190ML,https://image.istarbucks.co.kr/upload/store/skuimg/2024/03/[9300000004346]_20240328133444046.jpg,"과일 및 채소를 착즙하여 만든 주스!
사과, 비트, 당근이 들어가 과일&채소를 달콤하게 즐길 수 있는 음료",product_juice,,90,0.1,1,0.7,0,45,16,0,0,20
138,레몬 진저 클렌즈 190ML,Lemon Ginger Cleanse Juice 190ML,https://image.istarbucks.co.kr/upload/store/skuimg/2024/03/[9300000004347]_20240328133658373.jpg,"과일 및 채소를 착즙하여 만든 주스!
레몬, 생강이 들어가 과일&채소를 상큼하게 즐길 수 있는 음료",product_juice,,100,0.1,1,0.9,0,0,16,0,0,22
139,케일 클렌즈 190ML,Kale Cleanse Juice 190ML,https://image.istarbucks.co.kr/upload/store/skuimg/2024/03/[9300000004348]_20240328133830514.jpg,"과일 및 채소를 착즙하여 만든 주스!
케일, 셀러리, 오이가 들어가 과일&채소를 건강하게 즐길 수 있는 음료",product_juice,,90,0.2,1,0.9,0,15,15,0,0,19
140,딸기주스 190ML,Strawberry Juice 190ML,https://image.istarbucks.co.kr/upload/store/skuimg/2021/04/[5210008070]_20210426095035197.jpg,달콤한 국내산 딸기의 과육이 듬뿍 느껴지는 주스,product_juice,,110,0,0,0.6,0,30,25,0,0,27
141,망고주스 190ML,Mango Juice 190ML,https://image.istarbucks.co.kr/upload/store/skuimg/2021/04/[5210008061]_20210426095229497.jpg,노랗게 익은 열대과일 망고가 입안 가득 느껴지는 주스,product_juice,,117,0,1,0,0,15,23,0,0,27
142,스타 루비 자몽 스위트 190ML,Star Ruby Grapefruit Sweet 190ML,https://image.istarbucks.co.kr/upload/store/skuimg/2021/10/[9300000003773]_20211020094026512.jpg,"리프레시가 필요할 땐!  
상큼 달콤한 자몽으로 채우기
과즙이 풍부한 스타 루비 자몽이 가득 들어간 상큼한 음료",product_juice,,129,0,0.2,0,0,5,32,0,0,32
143,유기농 오렌지 100% 주스 190ML,Organic Orange 100% Juice 190ML,https://image.istarbucks.co.kr/upload/store/skuimg/2021/10/[9300000003771]_20211020093813176.jpg,"프리미엄 유기농 오렌지 주스로
스페인산 오렌지 착즙! 
오렌지 그대로 100% 담긴 3개 분량
물, 설탕, 첨가물 없는 오렌지 그대로의 맛
",product_juice,,95,0,2,0.6,0,5,20,0,0,20
144,유기농 오렌지 100% 주스 591ML,Organic Orange 100% Juice 591ML,https://image.istarbucks.co.kr/upload/store/skuimg/2021/10/[9300000003772]_20211020095105279.jpg,"프리미엄 유기농 오렌지 주스로
스페인산 오렌지 착즙! 
오렌지 그대로 100% 담긴 8개 분량
물, 설탕, 첨가물 없는 오렌지 그대로의 맛",product_juice,,290,0.6,6,1.9,0,10,62,0,0,62
145,케일&사과주스 190ML,Kale&Apple Juice 190ML,https://image.istarbucks.co.kr/upload/store/skuimg/2021/04/[5210008072]_20210426100712961.jpg,국내산 케일과 사과의 달콤함이 조화로운 녹색 주스,product_juice,,105,0,0,0,0,25,26,0,0,26
146,핑크 용과 레모네이드 190ML,Pink Dragon Fruit Lemonade 190ML,https://image.istarbucks.co.kr/upload/store/skuimg/2021/10/[9300000003776]_20211020094322052.jpg,"레드 용과의 상큼함에 
구아바와 망고스틴의 달콤함이 추가되어 
맛도, 컬러도 화사함이 느껴지는 음료",product_juice,,88,0,0,0,0,5,19,0,0,22
147,한라봉주스 190ML,Hallabong Juice 190ML,https://image.istarbucks.co.kr/upload/store/skuimg/2023/03/[5210008055]_20230331142559421.jpg,새콤달콤한 황금빛 제주 한라봉을 그대로 담아낸 주스,product_juice,,88,0,1,0,0,10,20,0,0,21
148,햇사과 주스 190ML,Newly Harvested Apple Juice 190ML,https://image.istarbucks.co.kr/upload/store/skuimg/2021/04/[9300000002565]_20210426102753431.jpg,달콤새콤한 햇사과 1개 반을 껍질 그대로 착즙한 사과 주스,product_juice,,113,0,0.2,0,0,10,27,0,0,28
149,햇사과 주스 591ML,Newly Harvested Apple Juice 591ML,https://image.istarbucks.co.kr/upload/store/skuimg/2022/10/[9300000004407]_20221027102828714.jpg,"햇 사과 네개 반을 껍질 그대로  착즙한 신선한 맛의 사과 주스
대용량으로 즐겨보세요.
",product_juice,,360,0,1.3,0.3,0,20,84,0,0,88
150,딸기 가득 요거트 190ML,Strawberry Yogurt 190ML,https://image.istarbucks.co.kr/upload/store/skuimg/2021/10/[9300000003775]_20211020094208586.jpg,상큼 달콤 딸기 과육이 한가득 씹히는 마시는 요거트 음료,product_juice,알레르기 유발요인 : 우유,155,3.2,4,5,0.2,50,21,0,15,23
151,블루베리 요거트 190ML,Blueberry Yogurt 190ML,https://image.istarbucks.co.kr/upload/store/skuimg/2021/04/[5210008063]_20210419104847771.jpg,블루베리 과육이 입안 가득 느껴지는 마시는 요거트,product_juice,알레르기 유발요인 : 우유,155,3.6,5,6,0.2,70,18,0,20,21
