,Korean Name,English Name,Image Url,Explanation,Category,Factors,kcal,sat_FAT,protein,fat,trans_FAT,sodium,sugars,caffeine,cholesterol,chabo
64,더블 레몬 블렌디드,Double Lemon Blended,https://image.istarbucks.co.kr/upload/store/skuimg/2024/04/[9200000005171]_20240424090245102.jpg,"레몬 2개 분량의 과실 및 비타민C가 들어있어
상큼하게 기분 전환시킬 수 있는 논카페인 과일 블렌디드
취향에 따라 클래식 시럽을 무료로 추가 하실 수 있습니다.",product_blended,,75,0,0,0.1,0,65,17,0,0,49
65,스타벅스 클래식 밀크 티 블렌디드,Starbucks Classic Milk Tea Blended,https://image.istarbucks.co.kr/upload/store/skuimg/2024/04/[9200000005165]_20240423124403024.jpg,"인기 음료 클래식 밀크 티를 색다르게 즐겨 보세요!
티의 맛과 풍미는 더 올라가면서
여름철 즐기기 좋은 블렌디드 타입 입니다.",product_blended,알레르기 유발요인 : 우유,240,7,3,8,0,85,36,46,10,38
66,망고 패션 티 블렌디드,Mango Passion Tea Blended,https://image.istarbucks.co.kr/upload/store/skuimg/2023/02/[9200000004512]_20230207150514519.jpg,"망고 패션 프루트 주스와 패션 탱고 티가 
상큼하게 어우러진 과일 블렌디드 ",product_blended,알레르기 유발요인 : 대두,150,0,2,1.1,0,105,29,0,0,35
67,북한산 레몬 얼 그레이 블렌디드,Bukhansan Lemon Earl Grey Blended,https://image.istarbucks.co.kr/upload/store/skuimg/2023/11/[9200000004716]_20231115093249657.jpg,"꼬냑 향을 가미한 상큼한 레모네이드와 은은한 얼 그레이 티가 어우러진 블렌디드 음료
",product_blended,,110,0.1,0,0.2,0,10,25,8,0,28
68,스타벅스 클래식 밀크티 블렌디드,Starbucks Classic Milk Tea Blended,https://image.istarbucks.co.kr/upload/store/skuimg/2023/12/[9200000004945]_20231205083518537.jpg,"블랙티의 풍미와 향이 더욱 풍요롭게 
느껴질 수 있는 밀크티 블렌디드",product_blended,알레르기 유발요인 : 우유,315,13,3,16,0,55,37,60,10,40
69,여수 바다 유자 블렌디드,Yeosu Sea Yuja Blended,https://image.istarbucks.co.kr/upload/store/skuimg/2023/09/[9200000004870]_20230905110300704.jpg,"맑고 깨끗한 여수 경도의 낮 바다 풍경을 형상화한 음료로
상큼하게 즐길 수 있는 유자 블렌디드 음료 (유자:국내산)",product_blended,,235,0,0,0,0,10,57,0,0,58
70,딸기 딜라이트 요거트 블렌디드,Strawberry Delight Yogurt Blended,https://image.istarbucks.co.kr/upload/store/skuimg/2021/04/[9200000003276]_20210416154001576.jpg,"유산균이 살아있는 리얼 요거트와 풍성한 딸기 과육이 
더욱 상큼하게 어우러진 과일 요거트 블렌디드",product_blended,알레르기 유발요인 : 우유,310,4.3,10,8,0,110,43,0,20,59
71,망고 바나나 블렌디드,Mango Banana Blended,https://image.istarbucks.co.kr/upload/store/skuimg/2021/04/[169001]_20210419130701935.jpg,"(Grande Only) 달콤한 망고 패션 프루트 주스에 
바나나 1개가 통째로 들어간 신선한 블렌디드",product_blended,알레르기 유발요인 : 대두 / 우유,290,0.9,4,2.7,0,130,45,0,5,58
72,코튼 스카이 요거트 블렌디드,Cotton Sky Yogurt Blended,https://image.istarbucks.co.kr/upload/store/skuimg/2023/09/[9200000004871]_20230922091835732.jpg,"고층 매장에서 느낄 수 있는 드넓은 전경을 형상화한 음료로,
붉게 노을지는 하늘을 표현한 솜사탕 토핑과 함께 즐길 수 있는 피나콜라다 컨셉의 음료. ",product_blended,알레르기 유발요인 : 우유,270,1.8,4,3.7,0,65,41,0,10,69
73,딸기 아사이 레모네이드 스타벅스 리프레셔,Strawberry Acai with Lemonade Starbucks Refreshers™,https://image.istarbucks.co.kr/upload/store/skuimg/2023/07/[9200000004753]_20230720103623518.jpg,"딸기, 아사이베리 주스와 레모네이드가 달콤 상큼하게 조화된 맛에 가볍게 에너지 부스팅을 할 수 있는 리프레셔 음료.",product_refresher,,265,0,1,0.1,0,0,62,73,0,64
74,딸기 아사이 레모네이드 스타벅스 리프레셔,Strawberry Acai with Lemonade Starbucks Refreshers™,https://image.istarbucks.co.kr/upload/store/skuimg/2022/08/[9200000003763]_20220803131322900.jpg,"딸기, 아사이베리 주스와 레모네이드가 달콤 상큼하게 조화된 맛에 가볍게 에너지 부스팅을 할 수 있는 리프레셔 음료",product_refresher,,105,0,1,0.1,0,0,24,30,0,25
75,망고 용과 레모네이드 스타벅스 리프레셔,Mango Dragonfruit with Lemonade Starbucks Refreshers™,https://image.istarbucks.co.kr/upload/store/skuimg/2023/07/[9200000004439]_20230710134200155.jpg,"망고 용과와 레모네이드가 달콤 상큼하게 조화된 맛에
가볍게 에너지 부스팅을 할 수 있는 음료",product_refresher,,95,0,0,0,0,35,23,25,0,24
76,라이트 핑크 자몽 피지오,Light Pink Grapefruit Fizzio,https://image.istarbucks.co.kr/upload/store/skuimg/2024/04/[9200000005168]_20240430164715855.jpg,"달콤 쌉싸름한 자몽에 청량함을 가득 담은 핑크 자몽 피지오
당, 칼로리가 더욱 라이트하게 돌아온 핑크 자몽 피지오를 가볍게 즐겨 보세요
",product_fizzio,,70,0,0,0.1,0,0,17,0,0,38
77,레드 애플 피지오,Red Apple Fizzio,https://image.istarbucks.co.kr/upload/store/skuimg/2023/10/[9200000004949]_20231005084714634.jpg,달콤상큼한 사과맛으로 가볍게 즐길 수 있는 애플 피지오,product_fizzio,,110,0,0,0,0,10,26,0,0,27
78,아이스크림 레드 애플 피지오,Ice Cream Red Apple Fizzio,https://image.istarbucks.co.kr/upload/store/skuimg/2024/01/[9200000004948]_20240103144748827.jpg,"리저브 전용 아이스크림과 함께 달콤 상큼한 사과맛으로
부드럽게 먹을 수 있는 애플 피지오",product_fizzio,알레르기 유발요인 : 우유,240,5,2,7,0,45,36,0,10,40
79,여수 바다 자몽 피지오,Yeosu Sea Grapefruit Fizzio,https://image.istarbucks.co.kr/upload/store/skuimg/2023/09/[9200000004751]_20230907153225732.jpg,"여수 돌산대교의 밤바다 풍경을 형상화한 음료로
알록달록 색상 조명의 토핑과 함께
여수의 풍경을 바라보며 즐길 수 있는 트로피컬 맛의 음료
",product_fizzio,알레르기 유발요인 : 복숭아,250,0,1,0.8,0,105,45,0,0,60
80,유자 패션 피지오,Yuja Passion Starbucks Fizzio,https://image.istarbucks.co.kr/upload/store/skuimg/2022/05/[9200000004121]_20220517102911830.jpg,"상콤달콤 고흥 유자와 스타벅스 시그니처 패션 탱고 티에
한 잔 한 잔 탄산을 넣어 제조하는 피지오 음료.
시트러스한 청량감을 가득 즐기세요!",product_fizzio,,145,0,0,0,0,5,36,0,0,36
81,제주팔삭 셔벗 피지오,Jeju Hassaku Orange Frozen Fizzio,https://image.istarbucks.co.kr/upload/store/skuimg/2024/01/[9200000004946]_20240103145000272.jpg,"제주송당의 소원나무에 걸린 제주 동백꽃을 형상화한 음료
제주의 자몽이라는 별명을 가진 제주 팔삭과 제주 한라봉으로
매장에서 직접 만든 셔벗과 함께 상큼하게 즐길 수 있는 피지오 음료",product_fizzio,,165,0,0,0,0,5,38,0,0,42
82,제주팔삭 피지오,Jeju Hassaku Orange Fizzio,https://image.istarbucks.co.kr/upload/store/skuimg/2023/10/[9200000004947]_20231005084610879.jpg,"제주의 자몽이라는 별명을 가진 팔삭과 제주 한라봉으로
상큼하고 가볍게 즐길 수 있는 피지오 음료",product_fizzio,,150,0,0,0,0,5,34,0,0,38
83,쿨 라임 피지오,Cool Lime Starbucks Fizzio™,https://image.istarbucks.co.kr/upload/store/skuimg/2021/04/[107051]_20210419112152119.jpg,그린 빈 추출액이 들어간 라임 베이스에 건조된 라임 슬라이스를 넣고 스파클링한 시원하고 청량감 있는 음료입니다. (카페인이 함유된 탄산음료입니다),product_fizzio,,105,0,0,0,0,20,25,110,0,28
84,피치 딸기 피지오,Peach Strawberry Starbucks Fizzio,https://image.istarbucks.co.kr/upload/store/skuimg/2023/05/[9200000004567]_20230524144959959.jpg,"상큼한 과일과 청량한 탄산의 조화.
피치 특유의 감각적인 색상과 무드를
탄산과 함께 즐길 수 있는 피지오",product_fizzio,알레르기 유발요인 : 복숭아,145,0,0,0,0,20,26,37,0,35
85,민트 블렌드 티,Mint Blend Brewed Tea ,https://image.istarbucks.co.kr/upload/store/skuimg/2021/04/[4004000000056]_20210415135215781.jpg,"스피어민트, 페퍼민트, 레몬머틀이 블렌딩된 상쾌한 허브 티",product_tea,,0,0,0,0,0,0,0,0,0,0
86,아이스 민트 블렌드 티,Iced Mint Blend Brewed Tea,https://image.istarbucks.co.kr/upload/store/skuimg/2021/04/[4004000000059]_20210415141656185.jpg,"스피어민트, 페퍼민트, 레몬머틀이 블렌딩된 상쾌한 허브 티",product_tea,,0,0,0,0,0,0,0,0,0,0
87,아이스 얼 그레이 티,Iced Earl Grey Brewed Tea,https://image.istarbucks.co.kr/upload/store/skuimg/2021/04/[4004000000039]_20210415142056015.jpg,꽃향 가득한 라벤더와 베르가못 향이 진한 홍차와 블렌딩된 향긋한 블랙 티,product_tea,,0,0,0,0,0,0,0,50,0,0
88,아이스 유스베리 티,Iced Youthberry™Brewed Tea,https://image.istarbucks.co.kr/upload/store/skuimg/2021/04/[9200000000229]_20210415142219633.jpg,"제주산 찻잎으로 만든 황차에 사과, 망고, 파인애플, 히비스커스, 로즈힙 등이
블렌딩되어 핑크빛 컬러가 감도는 수색과 베리류의 새콤함을 느낄 수 있는 옐로우 티",product_tea,,0,0,0,0,0,0,0,20,0,0
89,아이스 유자 민트 티,Iced Yuja Mint Tea,https://image.istarbucks.co.kr/upload/store/skuimg/2022/04/[9200000002959]_20220411155905055.jpg,달콤한 국내산 고흥 유자와 알싸하고 은은한 진저와 상쾌한 민트 티가 조화로운 유자 민트 티,product_tea,,145,0,0,0,0,5,37,0,0,37
90,아이스 잉글리쉬 브렉퍼스트 티,Iced English Breakfast Brewed Tea,https://image.istarbucks.co.kr/upload/store/skuimg/2021/04/[4004000000019]_20210415142323601.jpg,"인도 아삼, 제주도 유기농 홍차가 블렌딩되어 진한 벌꿀향과 그윽한 몰트향이 특징인 블랙 티",product_tea,,0,0,0,0,0,0,0,40,0,0
91,아이스 제주 유기농 녹차로 만든 티,Iced Jeju Green Tea,https://image.istarbucks.co.kr/upload/store/skuimg/2021/04/[400400000094]_20210415230316646.jpg,"유기농 녹차 티백만을 100%(물 제외) 사용한 티로
맑은 수색과 고유의 풍미가 뛰어난 녹차",product_tea,,0,0,0,0,0,0,0,16,0,0
92,아이스 제주팔삭 & 자몽 허니 블랙 티,Iced Jeju Hassaku Orange & Grapefruit Honey Black Tea,https://image.istarbucks.co.kr/upload/store/skuimg/2023/10/[9200000004944]_20231005084446623.jpg,"제주의 자몽이라는 별명을 가진 팔삭과 마누카꿀로
자몽과 블랙티의 맛을 더욱 고급스럽게 즐길 수 있는 음료",product_tea,,140,0,0,0,0,5,38,27,0,38
93,아이스 캐모마일 블렌드 티,Iced Chamomile Blend Brewed Tea ,https://image.istarbucks.co.kr/upload/store/skuimg/2021/04/[4004000000079]_20210415143641288.jpg,"캐모마일과 레몬 그라스, 레몬밤, 히비스커스 등 블렌딩되어
은은하고 차분한 향이 기분을 좋게하는 허브 티",product_tea,,0,0,0,0,0,0,0,0,0,0
94,아이스 히비스커스 블렌드 티,Iced Hibiscus Blend Brewed Tea,https://image.istarbucks.co.kr/upload/store/skuimg/2021/04/[4004000000069]_20210415143811387.jpg,"히비스커스, 사과, 파파야, 망고, 레몬그라스 등이 블렌딩된 상큼한 허브 티",product_tea,,0,0,0,0,0,0,0,0,0,0
95,얼 그레이 티,Earl Grey Brewed Tea,https://image.istarbucks.co.kr/upload/store/skuimg/2021/04/[4004000000036]_20210415143933578.jpg,꽃향 가득한 라벤더와 베르가못 향이 진한 홍차와 블렌딩된 향긋한 블랙 티,product_tea,,0,0,0,0,0,0,0,70,0,0
96,유스베리 티,Youthberry™Brewed Tea,https://image.istarbucks.co.kr/upload/store/skuimg/2021/04/[9200000000226]_20210415144434675.jpg,"제주산 찻잎으로 만든 황차에 사과, 망고, 파인애플, 히비스커스, 로즈힙 등이
블렌딩되어 핑크빛 컬러가 감도는 수색과 베리류의 새콤함을 느낄 수 있는 옐로우 티",product_tea,,0,0,0,0,0,0,0,20,0,0
97,유자 민트 티,Yuja Mint Tea,https://image.istarbucks.co.kr/upload/store/skuimg/2022/04/[9200000002956]_20220411155552087.jpg,"달콤한 국내산 고흥 유자와 알싸하고 은은한 진저, 
우릴 수록 상쾌한 민트 티가 조화로운 유자 민트 티",product_tea,,235,0,0,0,0,10,58,0,0,58
98,잉글리쉬 브렉퍼스트 티,English Breakfast Brewed Tea,https://image.istarbucks.co.kr/upload/store/skuimg/2021/04/[4004000000016]_20210415153648749.jpg,"인도 아삼, 제주도 유기농 홍차가 블렌딩되어 진한 벌꿀향과 그윽한 몰트향이 특징인 블랙 티",product_tea,,0,0,0,0,0,0,0,70,0,0
99,자몽 허니 블랙 티,Grapefruit Honey Black Tea,https://image.istarbucks.co.kr/upload/store/skuimg/2021/04/[9200000000187]_20210419131229682.jpg,새콤한 자몽과 달콤한 꿀이 깊고 그윽한 풍미의 스타벅스 티바나 블랙 티의 조화,product_tea,,125,0,0,0,0,5,30,70,0,31
100,제주 유기농 녹차로 만든 티,Jeju Green Tea,https://image.istarbucks.co.kr/upload/store/skuimg/2021/04/[400400000091]_20210415132230094.jpg,"유기농 녹차 티백만을 100%(물 제외) 사용한 티로
맑은 수색과 고유의 풍미가 뛰어난 녹차",product_tea,,0,0,0,0,0,0,0,16,0,0
101,제주팔삭 & 자몽 허니 블랙 티,Jeju Hassaku Orange & Grapefruit Honey Black Tea,https://image.istarbucks.co.kr/upload/store/skuimg/2023/10/[9200000004943]_20231005084425183.jpg,"제주의 자몽이라는 별명을 가진 팔삭과 마누카꿀로
자몽과 블랙티의 맛을 더욱 고급스럽게 즐길 수 있는 음료",product_tea,,140,0,0,0,0,5,38,70,0,38
102,캐모마일 블렌드 티,Chamomile Blend Brewed Tea ,https://image.istarbucks.co.kr/upload/store/skuimg/2021/04/[4004000000076]_20210415154920905.jpg,"캐모마일과 레몬 그라스, 레몬밤, 히비스커스 등 블렌딩되어
은은하고 차분한 향이 기분을 좋게하는 허브 티",product_tea,,0,0,0,0,0,0,0,0,0,0
103,히비스커스 블렌드 티,Hibiscus Blend Brewed Tea ,https://image.istarbucks.co.kr/upload/store/skuimg/2021/04/[4004000000066]_20210415155836546.jpg,"히비스커스, 사과, 파파야, 망고, 레몬그라스 등이 블렌딩된 상큼한 허브 티",product_tea,,0,0,0,0,0,0,0,0,0,0
104,레드 파워 패션 티,Red Power Passion Tea,https://image.istarbucks.co.kr/upload/store/skuimg/2023/04/[9200000004566]_20230407153247324.jpg,"딸기와 복숭아의 화사함에 패션 탱고티의 산뜻함을 더해 
한 모금 마시면 두근거리는 열정이 다시 떠오르는 리프레싱 티 음료
",product_tea,알레르기 유발요인 : 복숭아,190,0,1,0,0,40,31,33,0,46
105,레몬 캐모마일 블렌드 티,Lemon Chamomile Blend Tea,https://image.istarbucks.co.kr/upload/store/skuimg/2023/12/[9200000004990]_20231212110704300.jpg,"상큼한 레몬에 캐모마일이
은은하게 감도는 무카페인 티",product_tea,,130,0,0,0,0,10,30,0,0,32
106,아이스 레몬 캐모마일 블렌드 티,Iced Lemon Chamomile Blend Tea,https://image.istarbucks.co.kr/upload/store/skuimg/2023/12/[9200000004991]_20231212110749715.jpg,"상큼한 레몬에 캐모마일이
은은하게 감도는 무카페인 티",product_tea,,130,0,0,0,0,10,30,0,0,32
107,아이스 자몽 허니 블랙 티,Iced Grapefruit Honey Black Tea,https://image.istarbucks.co.kr/upload/store/skuimg/2021/04/[9200000000190]_20210419131723681.jpg,새콤한 자몽과 달콤한 꿀이 깊고 그윽한 풍미의 스타벅스 티바나 블랙 티의 조화,product_tea,,125,0,0,0,0,5,30,30,0,31
108,아이스 자몽 허니 블랙 티,Iced Grapefruit Honey Black Tea,https://image.istarbucks.co.kr/upload/store/skuimg/2023/07/[9200000004769]_20230720103743914.jpg,새콤한 자몽과 달콤한 꿀이 깊고 그윽한 풍미의 스타벅스 티바나 블랙 티의 조화.,product_tea,,345,0,1,0,0,10,79,75,0,82
109,말차 티라미수 라떼,Malcha Tiramisu Latte,https://image.istarbucks.co.kr/upload/store/skuimg/2023/11/[9200000004954]_20231127093740911.jpg,"달콤 쌉싸름한 말차크림으로 부드럽게 즐길 수 있는 
디저트 타입의 말차 티라미수 음료",product_tea,알레르기 유발요인 : 우유,405,15,11,22,0,220,38,75,35,41
110,스노우 말차 라떼,Snow Malcha Latte,https://image.istarbucks.co.kr/upload/store/skuimg/2023/12/[9200000004988]_20231212110855289.jpg,"달콤한 글레이즈드 소스에 쌉싸름한 말차가
조화롭게 어우러진 티 라떼",product_tea,알레르기 유발요인 : 우유 / 쇠고기,370,14,11,19,0,210,32,65,40,41
111,스타벅스 클래식 밀크 티,Starbucks Classic Milk Tea,https://image.istarbucks.co.kr/upload/store/skuimg/2023/09/[9200000004933]_20230914141718421.jpg,"스타벅스가 선보이는 클래식한 밀크 티로,
진하게 오래 우려낸 티바나 블랙 티의 깊은 풍미와
우유의 조화로움을 담아낸 '맛'에 집중한 밀크 티",product_tea,알레르기 유발요인 : 우유,299,13,5,17,0,80,31,190,15,33
112,스타벅스 클래식 밀크 티 보틀,Starbucks Classic Milk Tea Bottle,https://image.istarbucks.co.kr/upload/store/skuimg/2023/10/[9200000004942]_20231005093132158.jpg,"진하게 우려낸 블랙 티의 깊은 풍미와
우유의 조화로움을 담아낸 클래식 밀크 티를
전용 보틀과 함께, 언제 어디서나,
편하게 즐겨보세요.(전용 보틀 / 500ml)",product_tea,알레르기 유발요인 : 우유,485,21,7,27,0,130,50,155,25,54
113,아이스 말차 티라미수 라떼,Iced Malcha Tiramisu Latte,https://image.istarbucks.co.kr/upload/store/skuimg/2023/11/[9200000004955]_20231127093837785.jpg,"달콤 쌉싸름한 말차크림으로 부드럽게 즐길 수 있는 
디저트 타입의 말차 티라미수 음료",product_tea,알레르기 유발요인 : 우유,345,13,8,19,0,170,33,75,25,36
114,아이스 스노우 말차 라떼,Iced Snow Malcha Latte,https://image.istarbucks.co.kr/upload/store/skuimg/2023/12/[9200000004989]_20231212110951107.jpg,"달콤한 글레이즈드 소스에 쌉싸름한 말차가
조화롭게 어우러진 티 라떼",product_tea,알레르기 유발요인 : 우유 / 쇠고기,310,12,8,16,0,160,27,65,30,36
115,아이스 스타벅스 클래식 밀크 티,Iced Starbucks Classic Milk Tea,https://image.istarbucks.co.kr/upload/store/skuimg/2023/09/[9200000004936]_20230914141811832.jpg,"스타벅스가 선보이는 클래식한 밀크 티로,
진하게 오래 우려낸 티바나 블랙 티의 깊은 풍미와
우유의 조화로움을 담아낸 '맛'에 집중한 밀크 티",product_tea,알레르기 유발요인 : 우유,198,9,3,11,0,50,21,80,10,22
116,아이스 얼 그레이 바닐라 티 라떼,Iced Earl Grey Vanilla Tea Latte,https://image.istarbucks.co.kr/upload/store/skuimg/2023/01/[9200000004288]_20230118085139758.jpg,"2가지 티(블랙티, 얼 그레이 티)가 조화롭게 어우러지고
얼 그레이 폼과 바닐라의 풍미가 은은하게 퍼져 
깔끔하고 부드러운 티 라떼 음료",product_tea,알레르기 유발요인 : 우유,275,9,7,15,0.2,100,24,29,20,29
117,아이스 제주 말차 라떼,Iced Jeju Malcha Latte,https://image.istarbucks.co.kr/upload/store/skuimg/2021/04/[9200000002499]_20210419130902691.jpg,"차광재배한 어린 녹찻잎을 곱게 갈아 
깊고 진한 말차 본연의 맛과 향을 
부드럽게 즐길 수 있는 제주 말차 라떼",product_tea,알레르기 유발요인 : 우유,155,3.6,6,6,0,95,16,60,20,18
118,아이스 차이 티 라떼,Iced Chai Tea Latte,https://image.istarbucks.co.kr/upload/store/skuimg/2021/04/[135612]_20210415142512952.jpg,"스파이시한 향과 독특한 계피향, 달콤한 차이로 만든 부드러운 티 라떼",product_tea,알레르기 유발요인 : 우유,190,3,5,5,0,70,31,70,15,32
119,얼 그레이 바닐라 티 라떼,Earl Grey Vanilla Tea Latte,https://image.istarbucks.co.kr/upload/store/skuimg/2023/01/[9200000004285]_20230118084943298.jpg,"2가지 티(블랙티, 얼 그레이 티)가 조화롭고
얼 그레이 폼과 바닐라의 풍미가 은은하게 퍼져 
깔끔하고 부드러운 티 라떼 음료",product_tea,알레르기 유발요인 : 우유,295,10,7,16,0.2,105,26,55,20,31
120,제주 말차 라떼,Jeju Malcha Latte,https://image.istarbucks.co.kr/upload/store/skuimg/2021/04/[9200000002496]_20210419131039504.jpg,"차광재배한 어린 녹찻잎을 곱게 갈아 
깊고 진한 말차 본연의 맛과 향을 
부드럽게 즐길 수 있는 제주 말차 라떼",product_tea,알레르기 유발요인 : 우유,205,5,9,9,0,130,20,60,25,22
121,차이 티 라떼,Chai Tea Latte,https://image.istarbucks.co.kr/upload/store/skuimg/2021/04/[135608]_20210415154244970.jpg,"스파이시한 향과 독특한 계피향, 달콤한 차이로 만든 부드러운 티 라떼",product_tea,알레르기 유발요인 : 우유,200,3,6,5,0,70,31,70,15,33
122,스타벅스 딸기 라떼,Starbucks Strawberry Milk,https://image.istarbucks.co.kr/upload/store/skuimg/2024/04/[9200000004939]_20240430143116139.jpg,봄을 상큼하게 물들이는 딸기의 새콤 달콤함과 우유의 부드러움이 어우러진 스타벅스 딸기 라떼,product_etc,알레르기 유발요인 : 우유,150,2,3,3.5,0,55,24,0,10,26
123,딸기 콜드폼 초콜릿,Strawberry Cold Foam Chocolate,https://image.istarbucks.co.kr/upload/store/skuimg/2023/12/[9200000004950]_20231204090637454.jpg,"딸기 풍미 가득한 스타벅스만의 딸기 콜드폼과 
은은한 초콜릿의 향으로 남녀노소 즐길 수 있는 음료",product_etc,알레르기 유발요인 : 우유,255,2,7,3.8,0,110,45,5,10,49
124,시그니처 핫 초콜릿,Signature Hot Chocolate,https://image.istarbucks.co.kr/upload/store/skuimg/2021/04/[72]_20210415140950127.jpg,깊고 진한 초콜릿과 부드러운 휘핑크림이 입안에서 사르르 녹는 초콜릿 음료,product_etc,알레르기 유발요인 : 우유,410,15,13,22,0,135,39,15,18,41
125,아이스 시그니처 초콜릿,Iced Signature Chocolate,https://image.istarbucks.co.kr/upload/store/skuimg/2021/04/[110621]_20210415140901783.jpg,깊고 진한 초콜릿과 부드러운 휘핑크림이 입안에서 사르르 녹는 초콜릿 음료,product_etc,알레르기 유발요인 : 우유,280,13,8,17,0,100,22,15,16,23
126,아이스 티라미수 초콜릿,Iced Tiramisu Chocolate,https://image.istarbucks.co.kr/upload/store/skuimg/2023/11/[9200000004953]_20231127094019740.jpg,리저브 다크 초콜릿을 활용하여 초콜릿 풍미 가득한 디저트 타입의 티라미수 초콜릿,product_etc,알레르기 유발요인 : 우유,335,11,7,17,0,130,34,10,20,41
127,티라미수 초콜릿,Tiramisu Chocolate,https://image.istarbucks.co.kr/upload/store/skuimg/2023/11/[9200000004952]_20231127093938000.jpg,리저브 다크 초콜릿을 활용하여 초콜릿 풍미 가득한 디저트 타입의 티라미수 초콜릿,product_etc,알레르기 유발요인 : 우유,420,14,11,21,0,200,41,10,35,47
128,플러피 판다 아이스 초콜릿,Fluffy Panda Iced Chocolate,https://image.istarbucks.co.kr/upload/store/skuimg/2021/04/[9200000003658]_20210422080248378.jpg,"고소한 헤이즐넛과 진한 초콜릿의 만남,
귀여운 판다까지 더해진 플러피 판다 아이스 초콜릿! 

* 용인에버랜드R 매장에서만 판매하는 음료입니다",product_etc,알레르기 유발요인 : 우유,415,16,11,22,0,150,39,0,30,46
129,플러피 판다 핫 초콜릿,Fluffy Panda Hot Chocolate,https://image.istarbucks.co.kr/upload/store/skuimg/2021/04/[9200000002594]_20210422080327971.jpg,"고소한 헤이즐넛과 진한 핫초콜릿의 만남,
귀여운 판다까지 더해진 플러피 판다 핫 초콜릿! 

* 용인에버랜드 매장에서만 판매하는 음료입니다",product_etc,알레르기 유발요인 : 우유,470,17,12,23,0,160,48,0,30,57
130,딸기 콜드폼 딸기 라떼,Strawberry Cold Foam Strawberry Latte,https://image.istarbucks.co.kr/upload/store/skuimg/2023/11/[9200000004951]_20231102101647780.jpg,"딸기 풍미 가득한 스타벅스만의 딸기 콜드폼과
딸기 본연의 맛을 즐길 수 있는 음료",product_etc,알레르기 유발요인 : 우유,235,2,6,3.4,0,110,41,0,10,44
131,스타벅스 슬래머,Starbucks Slammer,https://image.istarbucks.co.kr/upload/store/skuimg/2021/04/[9200000003659]_20210428134252286.jpg,"스트로베리와 아사이베리의 상큼, 달콤한 맛이 톡톡!
시원하고 통쾌한 그랜드 슬램을 위한 에너지 부스팅 음료~!

* SSG랜더스필드 매장에서만 판매하는 음료입니다.",product_etc,,235,0,0,0,0,0,55,0,0,59
132,스팀 우유,Steamed Milk,https://image.istarbucks.co.kr/upload/store/skuimg/2021/04/[17]_20210426095335069.jpg,부드럽고 담백한 따뜻한 우유.,product_etc,알레르기 유발요인 : 우유,215,7,13,11,0,173,18,0,36,18
133,아이스 제주 까망 라떼,Iced Jeju Black Sesame Latte,https://image.istarbucks.co.kr/upload/store/skuimg/2020/09/[9200000001302]_20200921171804533.jpg,"[제주지역 한정음료] 제주도의 돌담길과 하르방의 풍경을
느낄 수 있는 음료로 고소한 흑임자와 달콤한 소보로 토핑으로 
시원하게 누구나 즐길 수 있는 음료",product_etc,알레르기 유발요인 : 땅콩 / 대두 / 우유 / 알류 / 밀 / 오징어,440,11,10,22,0,210,45,0,25,49
134,우유,Milk,https://image.istarbucks.co.kr/upload/store/skuimg/2021/04/[18]_20210426095514150.jpg,부드럽고 담백한 신선한 우유.,product_etc,알레르기 유발요인 : 우유,240,8,12,13,0,200,18,0,40,18
